{
    "$schema": "http://json-schema.org/draft-04/schema#",
    "$id": "branches.schema.json",
    "title": "List of Branches",
    "description": "This document records the structure expected for the branches file.",
    "type": "array",
    "items": {
        "description": "Branch objects",
        "type": "object",
        "properties": {
            "id": {
                "type": "string"
            },
            "name": {
                "type": "string"
            },
            "region":{
                "enum": ["dan","center","haifa","south","north"]
            },
            "kosher":{
                "type": "boolean"
            }
        },
        "required": [
            "id",
            "name",
            "region",
            "kosher"
        ],
        "additionalProperties": false,
        "minItems": 1,
        "uniqueItems": true
    }
}